{
  "meta": {
    "name": "Calibration-Flat-Turns",
    "author": "SemyonGit",
    "category": "beginner",
    "difficulty": 1,
    "creativity": 1,
    "generated_by": "Codex (OpenAI)",
    "generated_at": "2026-09-14T00:00:00Z",
    "description": "Flat regression course with both left and right curves. Current in-game check pending."
  },
  "settings": {
    "environment": "Stadium",
    "mood": "Day"
  },
  "blocks": [
    {
      "id": "StadiumRoadMainStart",
      "x": 10,
      "y": 1,
      "z": 10,
      "rotation": 1,
      "flags": 0
    },
    {
      "id": "StadiumRoadMainStraight",
      "x": 11,
      "y": 1,
      "z": 10,
      "rotation": 1,
      "flags": 0
    },
    {
      "id": "StadiumRoadMainStraight",
      "x": 12,
      "y": 1,
      "z": 10,
      "rotation": 1,
      "flags": 0
    },
    {
      "id": "StadiumRoadMainStraight",
      "x": 13,
      "y": 1,
      "z": 10,
      "rotation": 1,
      "flags": 0
    },
    {
      "id": "StadiumRoadMainCurve1Right",
      "x": 14,
      "y": 1,
      "z": 10,
      "rotation": 1,
      "flags": 0
    },
    {
      "id": "StadiumRoadMainStraight",
      "x": 14,
      "y": 1,
      "z": 11,
      "rotation": 2,
      "flags": 0
    },
    {
      "id": "StadiumRoadMainStraight",
      "x": 14,
      "y": 1,
      "z": 12,
      "rotation": 2,
      "flags": 0
    },
    {
      "id": "StadiumRoadMainCheckpointIn",
      "x": 14,
      "y": 1,
      "z": 13,
      "rotation": 2,
      "flags": 0
    },
    {
      "id": "StadiumRoadMainCurve1Left",
      "x": 14,
      "y": 1,
      "z": 14,
      "rotation": 2,
      "flags": 0
    },
    {
      "id": "StadiumRoadMainStraight",
      "x": 15,
      "y": 1,
      "z": 14,
      "rotation": 1,
      "flags": 0
    },
    {
      "id": "StadiumRoadMainStraight",
      "x": 16,
      "y": 1,
      "z": 14,
      "rotation": 1,
      "flags": 0
    },
    {
      "id": "StadiumRoadMainStraight",
      "x": 17,
      "y": 1,
      "z": 14,
      "rotation": 1,
      "flags": 0
    },
    {
      "id": "StadiumRoadMainCurve1Left",
      "x": 18,
      "y": 1,
      "z": 14,
      "rotation": 1,
      "flags": 0
    },
    {
      "id": "StadiumRoadMainStraight",
      "x": 18,
      "y": 1,
      "z": 13,
      "rotation": 0,
      "flags": 0
    },
    {
      "id": "StadiumRoadMainStraight",
      "x": 18,
      "y": 1,
      "z": 12,
      "rotation": 0,
      "flags": 0
    },
    {
      "id": "StadiumRoadMainCheckpointIn",
      "x": 18,
      "y": 1,
      "z": 11,
      "rotation": 0,
      "flags": 0
    },
    {
      "id": "StadiumRoadMainCurve1Right",
      "x": 18,
      "y": 1,
      "z": 10,
      "rotation": 0,
      "flags": 0
    },
    {
      "id": "StadiumRoadMainStraight",
      "x": 19,
      "y": 1,
      "z": 10,
      "rotation": 1,
      "flags": 0
    },
    {
      "id": "StadiumRoadMainStraight",
      "x": 20,
      "y": 1,
      "z": 10,
      "rotation": 1,
      "flags": 0
    },
    {
      "id": "StadiumRoadMainFinish",
      "x": 21,
      "y": 1,
      "z": 10,
      "rotation": 1,
      "flags": 0
    }
  ],
  "checkpoints": [
    7,
    15
  ],
  "sections": []
}
